{
  "requirements": [
    {
      "type": "factionapi:stat",
      "amount": 20,
      "description": {
        "translate": "stat.vampirism.infected_creatures"
      },
      "id": "vampirism:infected_creatures",
      "stat": "vampirism:infected_creatures"
    }
  ],
  "reward": {
    "type": "factionapi:item",
    "item": {
      "count": 5,
      "id": "minecraft:gold_ingot"
    }
  },
  "title": {
    "translate": "task.vampirism.v_infect1"
  },
  "unlocker": []
}