{
  "requirements": [
    {
      "type": "factionapi:item",
      "description": {
        "translate": "item.minecraft.diamond_block"
      },
      "id": "minecraft:diamond_block",
      "item": {
        "count": 8,
        "id": "minecraft:diamond_block"
      }
    },
    {
      "type": "factionapi:entity",
      "amount": 20,
      "description": {
        "translate": "entity.vampirism.vampire_baron"
      },
      "entityType": "vampirism:vampire_baron",
      "id": "vampirism:vampire_baron"
    },
    {
      "type": "factionapi:item",
      "description": {
        "translate": "item.vampirism.vampire_blood_bottle"
      },
      "id": "vampirism:vampire_blood_bottle",
      "item": {
        "count": 32,
        "id": "vampirism:vampire_blood_bottle"
      }
    },
    {
      "type": "factionapi:item",
      "description": {
        "translate": "item.vampirism.vampire_book"
      },
      "id": "vampirism:vampire_book",
      "item": {
        "id": "vampirism:vampire_book"
      }
    }
  ],
  "reward": {
    "type": "factionapi:item",
    "item": {
      "id": "vampirism:hunter_minion_upgrade_special"
    }
  },
  "title": {
    "translate": "task.vampirism.hunter_minion_upgrade_special"
  },
  "unlocker": [
    {
      "type": "factionapi:lord_level",
      "exact": false,
      "reqLordLevel": 5
    }
  ]
}